Enter password: ******
Welcome to the MySQL monitor.  Commands end with ; or \g.
Your MySQL connection id is 23
Server version: 5.5.51 MySQL Community Server (GPL)

Copyright (c) 2000, 2016, Oracle and/or its affiliates. All rights reserved.

Oracle is a registered trademark of Oracle Corporation and/or its
affiliates. Other names may be trademarks of their respective
owners.

Type 'help;' or '\h' for help. Type '\c' to clear the current input statement.

mysql> create database latihan3;
Query OK, 1 row affected (0.00 sec)

mysql> use latihan3;
Database changed
mysql> create table mahasiswa
    -> (NIM int(8) not null,
    -> Nama varchar(20) not null,
    -> AlamatJalan varchar(20) null,
    -> Kota varchar(15) not null,
    -> KodePos varchar(5) null,
    -> Nohp varchar(13) null,
    -> JenisKelamin varchar(10) not null,
    -> TanggalLahir date not null,
    -> KodeDosen varchar(8) null);
Query OK, 0 rows affected (0.13 sec)

mysql> insert into mahasiswa (NIM, Nama, AlamatJalan, Kota, KodePos, Nohp, JenisKelamin, TanggalLahir, KodeDosen)
    -> values ('11223344', 'Ari Susanto', '', 'Bekasi', '', '', 'Laki-laki', '1998-10-12', ''),
    -> ('11223345', 'Ario Talib', '', 'Cikarang', '', '', 'Laki-laki', '1999-11-16', ''),
    -> ('11223346', 'Dina Marlina', '', 'Karawang', '', '', 'Perempuan', '1997-12-01', ''),
    -> ('11223347', 'Lisa Ayu', '', 'Bekasi', '', '', 'Perempuan', '1996-01-02', ''),
    -> ('11223348', 'Tiara Wahida', '', 'Bekasi', '', '', 'Perempuan', '1980-02-05', ''),
    -> ('11223349', 'Anton Sinaga', '', 'Cikarang', '', '', 'Laki-laki', '1988-03-10', '');
Query OK, 6 rows affected (0.09 sec)
Records: 6  Duplicates: 0  Warnings: 0

mysql> select *from mahasiswa;
+----------+--------------+-------------+----------+---------+------+--------------+--------------+-----------+
| NIM      | Nama         | AlamatJalan | Kota     | KodePos | Nohp | JenisKelamin | TanggalLahir | KodeDosen |
+----------+--------------+-------------+----------+---------+------+--------------+--------------+-----------+
| 11223344 | Ari Susanto  |             | Bekasi   |         |      | Laki-laki    | 1998-10-12   |           |
| 11223345 | Ario Talib   |             | Cikarang |         |      | Laki-laki    | 1999-11-16   |           |
| 11223346 | Dina Marlina |             | Karawang |         |      | Perempuan    | 1997-12-01   |           |
| 11223347 | Lisa Ayu     |             | Bekasi   |         |      | Perempuan    | 1996-01-02   |           |
| 11223348 | Tiara Wahida |             | Bekasi   |         |      | Perempuan    | 1980-02-05   |           |
| 11223349 | Anton Sinaga |             | Cikarang |         |      | Laki-laki    | 1988-03-10   |           |
+----------+--------------+-------------+----------+---------+------+--------------+--------------+-----------+
6 rows in set (0.00 sec)

mysql> update mahasiswa
    -> set TanggalLahir='1997-08-31'
    -> where Nama='Ari Susanto';
Query OK, 1 row affected (0.03 sec)
Rows matched: 1  Changed: 1  Warnings: 0

mysql> select *from mahasiswa where Nama='Ari Susanto';
+----------+-------------+-------------+--------+---------+------+--------------+--------------+-----------+
| NIM      | Nama        | AlamatJalan | Kota   | KodePos | Nohp | JenisKelamin | TanggalLahir | KodeDosen |
+----------+-------------+-------------+--------+---------+------+--------------+--------------+-----------+
| 11223344 | Ari Susanto |             | Bekasi |         |      | Laki-laki    | 1997-08-31   |           |
+----------+-------------+-------------+--------+---------+------+--------------+--------------+-----------+
1 row in set (0.06 sec)

mysql> delete from mahasiswa where Nama='Dina Marlina';
Query OK, 1 row affected (0.05 sec)

mysql> select *from mahasiswa;
+----------+--------------+-------------+----------+---------+------+--------------+--------------+-----------+
| NIM      | Nama         | AlamatJalan | Kota     | KodePos | Nohp | JenisKelamin | TanggalLahir | KodeDosen |
+----------+--------------+-------------+----------+---------+------+--------------+--------------+-----------+
| 11223344 | Ari Susanto  |             | Bekasi   |         |      | Laki-laki    | 1997-08-31   |           |
| 11223345 | Ario Talib   |             | Cikarang |         |      | Laki-laki    | 1999-11-16   |           |
| 11223347 | Lisa Ayu     |             | Bekasi   |         |      | Perempuan    | 1996-01-02   |           |
| 11223348 | Tiara Wahida |             | Bekasi   |         |      | Perempuan    | 1980-02-05   |           |
| 11223349 | Anton Sinaga |             | Cikarang |         |      | Laki-laki    | 1988-03-10   |           |
+----------+--------------+-------------+----------+---------+------+--------------+--------------+-----------+
5 rows in set (0.00 sec)

mysql> select *from mahasiswa
    -> where TanggalLahir <= '1996-01-02';
+----------+--------------+-------------+----------+---------+------+--------------+--------------+-----------+
| NIM      | Nama         | AlamatJalan | Kota     | KodePos | Nohp | JenisKelamin | TanggalLahir | KodeDosen |
+----------+--------------+-------------+----------+---------+------+--------------+--------------+-----------+
| 11223347 | Lisa Ayu     |             | Bekasi   |         |      | Perempuan    | 1996-01-02   |           |
| 11223348 | Tiara Wahida |             | Bekasi   |         |      | Perempuan    | 1980-02-05   |           |
| 11223349 | Anton Sinaga |             | Cikarang |         |      | Laki-laki    | 1988-03-10   |           |
+----------+--------------+-------------+----------+---------+------+--------------+--------------+-----------+
3 rows in set (0.00 sec)

mysql> select *from mahasiswa
    -> where Kota='Bekasi' and JenisKelamin='Perempuan';
+----------+--------------+-------------+--------+---------+------+--------------+--------------+-----------+
| NIM      | Nama         | AlamatJalan | Kota   | KodePos | Nohp | JenisKelamin | TanggalLahir | KodeDosen |
+----------+--------------+-------------+--------+---------+------+--------------+--------------+-----------+
| 11223347 | Lisa Ayu     |             | Bekasi |         |      | Perempuan    | 1996-01-02   |           |
| 11223348 | Tiara Wahida |             | Bekasi |         |      | Perempuan    | 1980-02-05   |           |
+----------+--------------+-------------+--------+---------+------+--------------+--------------+-----------+
2 rows in set (0.04 sec)

mysql> select *from mahasiswa
    -> where Kota='Bekasi' and JenisKelamin='Laki-laki' or JenisKelamin='Perempuan' and TanggalLahir <='1997-02-09';
+----------+--------------+-------------+--------+---------+------+--------------+--------------+-----------+
| NIM      | Nama         | AlamatJalan | Kota   | KodePos | Nohp | JenisKelamin | TanggalLahir | KodeDosen |
+----------+--------------+-------------+--------+---------+------+--------------+--------------+-----------+
| 11223344 | Ari Susanto  |             | Bekasi |         |      | Laki-laki    | 1997-08-31   |           |
| 11223347 | Lisa Ayu     |             | Bekasi |         |      | Perempuan    | 1996-01-02   |           |
| 11223348 | Tiara Wahida |             | Bekasi |         |      | Perempuan    | 1980-02-05   |           |
+----------+--------------+-------------+--------+---------+------+--------------+--------------+-----------+
3 rows in set (0.04 sec)

mysql> select Nama, Kota from mahasiswa;
+--------------+----------+
| Nama         | Kota     |
+--------------+----------+
| Ari Susanto  | Bekasi   |
| Ario Talib   | Cikarang |
| Lisa Ayu     | Bekasi   |
| Tiara Wahida | Bekasi   |
| Anton Sinaga | Cikarang |
+--------------+----------+
5 rows in set (0.00 sec)

mysql> select *from mahasiswa
    -> order by Nama asc;
+----------+--------------+-------------+----------+---------+------+--------------+--------------+-----------+
| NIM      | Nama         | AlamatJalan | Kota     | KodePos | Nohp | JenisKelamin | TanggalLahir | KodeDosen |
+----------+--------------+-------------+----------+---------+------+--------------+--------------+-----------+
| 11223349 | Anton Sinaga |             | Cikarang |         |      | Laki-laki    | 1988-03-10   |           |
| 11223344 | Ari Susanto  |             | Bekasi   |         |      | Laki-laki    | 1997-08-31   |           |
| 11223345 | Ario Talib   |             | Cikarang |         |      | Laki-laki    | 1999-11-16   |           |
| 11223347 | Lisa Ayu     |             | Bekasi   |         |      | Perempuan    | 1996-01-02   |           |
| 11223348 | Tiara Wahida |             | Bekasi   |         |      | Perempuan    | 1980-02-05   |           |
+----------+--------------+-------------+----------+---------+------+--------------+--------------+-----------+
5 rows in set (0.04 sec)

mysql>
